{
  "protocol_version": "1.0",
  "message_type": "verification_result",
  "run_id": "run-42",
  "sent_at": "2026-09-02T12:00:01Z",
  "payload": {
    "action_id": "action-184",
    "status": "SUCCESS",
    "evidence": {
      "observed_value": "1998-04-17",
      "field_valid": true,
      "page_fingerprint": "sha256:2f7a1c9e"
    },
    "recommended_transition": "CONTINUE"
  }
}
